{
  "$schema": "https://json-schema.org/draft/2020-12/schema",
  "$id": "https://echelonfoundry.com/schemas/echelon.catalog-snapshot.v1.json",
  "title": "Echelon Catalog Snapshot v1",
  "type": "object",
  "additionalProperties": false,
  "required": [
    "schema",
    "systems",
    "releases",
    "profiles"
  ],
  "properties": {
    "schema": {
      "const": "echelon.catalog-snapshot/v1"
    },
    "sourceCommit": {
      "type": "string",
      "pattern": "^[0-9a-f]{40}$"
    },
    "systems": {
      "type": "array",
      "items": {
        "type": "object",
        "additionalProperties": false,
        "required": [
          "id",
          "repository",
          "manifest"
        ],
        "properties": {
          "id": {
            "type": "string",
            "pattern": "^[a-z][a-z0-9-]*$"
          },
          "repository": {
            "type": "string",
            "pattern": "^[A-Za-z0-9_.-]+/[A-Za-z0-9._-]+$"
          },
          "manifest": {
            "type": "string",
            "minLength": 1
          },
          "sha256": {
            "type": "string",
            "pattern": "^[0-9a-f]{64}$"
          }
        }
      }
    },
    "releases": {
      "type": "array",
      "items": {
        "type": "object",
        "additionalProperties": false,
        "required": [
          "systemId",
          "version",
          "manifest",
          "sha256"
        ],
        "properties": {
          "systemId": {
            "type": "string",
            "pattern": "^[a-z][a-z0-9-]*$"
          },
          "version": {
            "type": "string",
            "pattern": "^(0|[1-9]\\d*)\\.(0|[1-9]\\d*)\\.(0|[1-9]\\d*)(?:-[0-9A-Za-z-]+(?:\\.[0-9A-Za-z-]+)*)?(?:\\+[0-9A-Za-z-]+(?:\\.[0-9A-Za-z-]+)*)?$"
          },
          "manifest": {
            "type": "string",
            "minLength": 1
          },
          "sha256": {
            "type": "string",
            "pattern": "^[0-9a-f]{64}$"
          }
        }
      }
    },
    "profiles": {
      "type": "array",
      "items": {
        "type": "object",
        "additionalProperties": false,
        "required": [
          "id",
          "version",
          "manifest",
          "sha256"
        ],
        "properties": {
          "id": {
            "type": "string",
            "pattern": "^[a-z][a-z0-9-]*$"
          },
          "version": {
            "type": "string",
            "pattern": "^(0|[1-9]\\d*)\\.(0|[1-9]\\d*)\\.(0|[1-9]\\d*)(?:-[0-9A-Za-z-]+(?:\\.[0-9A-Za-z-]+)*)?(?:\\+[0-9A-Za-z-]+(?:\\.[0-9A-Za-z-]+)*)?$"
          },
          "manifest": {
            "type": "string",
            "minLength": 1
          },
          "sha256": {
            "type": "string",
            "pattern": "^[0-9a-f]{64}$"
          }
        }
      }
    },
    "disabledCapabilities": {
      "description": "REG-PAIR-001: capabilities a profile pairs (capabilityPairings) that this snapshot records as disabled, with the reason. A disabled capability does not fail resolution; resolved sets report it as disabled.",
      "type": "array",
      "items": {
        "type": "object",
        "additionalProperties": false,
        "required": [
          "id",
          "reason"
        ],
        "properties": {
          "id": {
            "type": "string",
            "pattern": "^[a-z][a-z0-9-]*$"
          },
          "reason": {
            "type": "string",
            "minLength": 1
          }
        }
      }
    }
  }
}
