{
  "schema": "echelon.catalog-snapshot/v1",
  "systems": [
    {
      "id": "praxis",
      "repository": "kemiller2002/praxis",
      "manifest": "examples/praxis.system.json"
    },
    {
      "id": "ordo",
      "repository": "kemiller2002/ordo",
      "manifest": "examples/ordo.system.json"
    }
  ],
  "releases": [
    {
      "systemId": "praxis",
      "version": "3.6.0",
      "manifest": "releases/praxis/3.6.0.release.json",
      "sha256": "992e276ae0098b5c9b65cdd06f8c783aec95942c850e60d4bf06a28df22e6543"
    },
    {
      "systemId": "ordo",
      "version": "1.4.0",
      "manifest": "releases/ordo/1.4.0.release.json",
      "sha256": "79a813b1f04fc4ec964be11e2a304caf5d87bb527da0b4b1779be6fc6a112659"
    }
  ],
  "profiles": [
    {
      "id": "echelon-engineering",
      "version": "0.1.0",
      "manifest": "profiles/echelon-engineering.profile.json",
      "sha256": "14e1b28a2993e16c525673008dc9bd2004a2cce7332fbd03e103aa23b89a922f"
    }
  ]
}
